{
  "schema_version": 1,
  "run_id": "00000000-0000-4000-8000-000000000001",
  "source_id": "00000000-0000-4000-8000-000000000002",
  "seq": 1,
  "provider": "claude_code",
  "environment": "macos_native",
  "received_at": "2026-10-21T09:00:00Z",
  "source_at": null,
  "provenance": "provider_reported",
  "metric": {
    "kind": "context",
    "scope": "session",
    "entity_id": "00000000-0000-4000-8000-000000000005",
    "used_percent": 42.5,
    "capacity_tokens": 200000
  }
}
